title,link,date
DRC INVITES BIDS TO BUILD PRIMARY SCHOOLS,https://constructafrica.com/projects-and-tenders/drc-invites-bids-build-primary-schools,30/11/2023
DRC'S KASANGULU SMART CITY TO BREAK GROUND NEXT MONTH,https://constructafrica.com/news/drcs-kasangulu-smart-city-break-ground-next-month,22/11/2023
AFREXIMBANK PLANS AFRICAN QUALITY ASSURANCE CENTRES,https://constructafrica.com/news/afreximbank-plans-african-quality-assurance-centres,17/11/2023
DRC SEEKS CONSULTANT FOR WATER DISTRIBUTION PROJECT,https://constructafrica.com/projects-and-tenders/drc-seeks-consultant-water-distribution-project,15/11/2023
DRC SEEKS CONSULTANT FOR 93KM ROAD FEASIBILITY STUDY,https://constructafrica.com/projects-and-tenders/drc-seeks-consultant-93km-road-feasibility-study,14/11/2023
KENYA FIRM TO LEAD CONSTRUCTION OF SMART CITY PROJECT IN DR CONGO,https://gambetanews.com/kenya-firm-to-lead-construction-of-smart-city-project-in-dr-congo/,13/11/2023
BURUNDI FIRM AWARDED US$7 MILLION CONTRACT IN DRC ,https://constructafrica.com/projects-and-tenders/burundi-firm-awarded-us7-million-contract-drc,03/11/2023
DRC SEEKS CONSULTANTS FOR WATER INTAKE PROJECT,https://constructafrica.com/projects-and-tenders/drc-seeks-consultants-water-intake-project,31/10/2023
UNICEF INVITES PROPOSALS FOR 11 DRC SCHOOL CONTRACTS,https://constructafrica.com/projects-and-tenders/unicef-invites-proposals-11-drc-school-contracts,31/10/2023
MALAWI AND CHINA SIGN RAIL AGREEMENT,https://constructafrica.com/news/malawi-and-china-sign-rail-agreement,27/10/2023
HOW DAR ES SALAAM PORT INEFFICIENCES ARE DERAILING TANZANIA’S ECONOMY,https://gambetanews.com/how-dar-es-salaam-port-inefficiences-are-derailing-tanzanias-economy/,23/10/2023
EOIS SOUGHT FOR DRC RUNWAY ASPHALTING CONTRACT,https://constructafrica.com/projects-and-tenders/eois-sought-drc-runway-asphalting-contract,18/10/2023
SDGS: SUB-SAHARAN AFRICA LIKELY TO MISS KEY INFRASTRUCTURE GOALS,https://constructafrica.com/news/sdgs-sub-saharan-africa-likely-miss-key-infrastructure-goals,12/10/2023
DRC PRESIDENT MAKES INSPECTION OF RURAL INFRASTRUCTURE PROJECTS,https://constructafrica.com/news/drc-president-makes-inspection-rural-infrastructure-projects,10/10/2023
BUSANGA HYDROPOWER PLANT INAUGURATED IN DRC,https://constructafrica.com/news/busanga-hydropower-plant-inaugurated-drc,09/10/2023
ZAMBIA AND DRC BREAK GROUND ON LUAPULA BRIDGE,https://constructafrica.com/news/zambia-and-drc-break-ground-luapula-bridge,06/10/2023
DRC SEEKS CONSULTANT FOR 444KM ROAD PROJECT,https://constructafrica.com/projects-and-tenders/drc-seeks-consultant-444km-road-project,02/10/2023
US AND EU LOOK TO ACCELERATE LOBITO CORRIDOR EXPANSION,https://constructafrica.com/news/us-and-eu-look-accelerate-lobito-corridor-expansion,14/09/2023
RWANDA PUSHES ON WITH LAKE KIVU PROJECT,https://constructafrica.com/news/rwanda-pushes-lake-kivu-project,12/09/2023
DRC INVITES BIDS FOR 5 PUBLIC HEALTH LABORATORIES,https://constructafrica.com/projects-and-tenders/drc-invites-bids-5-public-health-laboratories,07/09/2023
DRC INVITES EOIS FROM CONSULTANTS FOR TRANSNATIONAL ROAD CORRIDOR TO ANGOLA,https://constructafrica.com/projects-and-tenders/drc-invites-eois-consultants-transnational-road-corridor-angola,28/08/2023
"Moldova gets EBRD loan for M1, M2 upgrades",https://www.worldhighways.com/wh12/news/moldova-gets-ebrd-loan-m1-m2-upgrades,28/08/2023
ZIMBABWE HIGHWAY EPITAPHS: THE WAY FORWARD,https://gambetanews.com/zimbabwe-highway-epitaphs-the-way-forward/,23/08/2023
Green light for D35 Litomysl-Janov bypass,https://www.worldhighways.com/wh12/news/green-light-d35-litomysl-janov-bypass,15/08/2023
UGANDA GENERAL COMMISSION MULTI-BILLION APARTMENT,https://gambetanews.com/uganda-general-commission-multi-billion-apartment/,15/08/2023
EAP ACQUIRES MAJORITY STAKE IN DRC SOLAR PROJECTS,https://constructafrica.com/news/eap-acquires-majority-stake-drc-solar-projects,09/08/2023
NAMIBIA GOVERNOR CALLS FOR KATIMA MULILO BORDER PROJECT TO BE FAST-TRACKED,https://gambetanews.com/namibia-governor-calls-for-katima-mulilo-border-project-to-be-fast-tracked/,09/08/2023
UK equipment sales bounce back in June,https://www.worldhighways.com/wh2/news/uk-equipment-sales-bounce-back-june,25/07/2023
HOW NEW REFINERY CONSTRUCTION CAN HELP ANGOLA CRUDE OIL INDUSTRY,https://gambetanews.com/how-new-refinery-construction-can-help-angola-crude-oil-industry/,24/07/2023
ROAD CONSTRUCTION LINKING DAR AND KAREMA PORT BEGANS IN TANZANIA,https://gambetanews.com/road-construction-linking-dar-and-karema-port-begans-in-tanzania/,13/07/2023
ANGOLA'S LOBITO CORRIDOR RAILWAY HANDED OVER TO INTERNATIONAL OPERATOR,https://constructafrica.com/news/angolas-lobito-corridor-railway-handed-over-international-operator,06/07/2023
TANZANIA TO BEGIN FLOAT GLASS PRODUCTION FROM SEPTEMBER,https://constructafrica.com/news/tanzania-begin-float-glass-production-september,05/07/2023
EAST AFRICA STANDARD GAUGE RAILWAY PROJECT ON TRACK,https://constructafrica.com/news/east-africa-standard-gauge-railway-project-track,22/06/2023
CHINA’S CRJE TO BUILD AFRICAN COURT HEADQUARTERS,https://constructafrica.com/news/chinas-crje-build-african-court-headquarters,16/06/2023
Czech tenders for D6 section near Karlovy Vary,https://www.worldhighways.com/wh12/news/czech-tenders-d6-section-near-karlovy-vary,07/06/2023
KENYA AND THREE OTHER AFRICAN COUNTIRES MAKING PLANS TO CONSTRUCT TRANS-AFRICAN RAILWAY LINE,https://gambetanews.com/kenya-and-three-other-african-countires-making-plans-to-construct-trans-african-railway-line/,30/05/2023
AFRICAN ECONOMIC OUTLOOK: AFDB PREDICTS 4% GDP GROWTH IN 2023-4,https://constructafrica.com/news/african-economic-outlook-afdb-predicts-4-gdp-growth-2023-4,26/05/2023
"Czech road project, bidding delay",https://www.worldhighways.com/wh10/news/czech-road-project-bidding-delay,22/05/2023
ECA CHEIF SAYS BRIDGING INFRASTRUCTURAL GAP WILL BENEFIT AfCFTA,https://gambetanews.com/eca-cheif-says-bridging-infrastructural-gap-will-benefit-afcfta/,16/05/2023
KWALA DRY PORT CONSTRUCTION COMPLETED IN TANZANIA,https://gambetanews.com/kwala-dry-port-construction-completed-in-tanzania/,08/05/2023
Czech highway planning works are underway,https://www.worldhighways.com/wh10/news/czech-highway-planning-works-are-underway,05/05/2023
ARISE IIP STARTS WORK ON SIERRA LEONE INDUSTRIAL ZONE,https://constructafrica.com/news/arise-iip-starts-work-sierra-leone-industrial-zone,02/05/2023
CEA: UK Construction equipment sales show strong growth in Q1,https://www.worldhighways.com/news/cea-uk-construction-equipment-sales-show-strong-growth-q1,26/04/2023
Road tender opening for Dominican Republic,https://www.worldhighways.com/wh10/news/road-tender-opening-dominican-republic,24/04/2023
TANZANIA GOVT ALLOCATE 2BN FUNDS FOR CONSTRUCTION OF ISOLATION CENTRE,https://gambetanews.com/tanzania-govt-allocate-2bn-funds-for-construction-of-isolation-centre/,13/04/2023
Uganda’s capital Kampala receiving road upgrade,https://www.worldhighways.com/wh9/news/ugandas-capital-kampala-receiving-road-upgrade,03/04/2023
WORK PROGRESSES ON TANZANIA’S KIGONGO-BUSISI BRIDGE ON LAKE VICTORIA,https://constructafrica.com/news/work-progresses-tanzanias-kigongo-busisi-bridge-lake-victoria,06/03/2023
Uganda expressway development project proposed,https://www.worldhighways.com/wh8/news/uganda-expressway-development-project-proposed,01/03/2023
TANZANIA AWARDS US$2.2 BILLION RAIL CONTRACT TO CHINESE CONSORTIUM,https://constructafrica.com/news/tanzania-awards-us22-billion-rail-contract-chinese-consortium,11/02/2023
Safety has no alternative,https://www.worldhighways.com/feature/safety-has-no-alternative,30/01/2023
TANZANIA GOVERNMENT SIGNS TSH38 BILLION DEAL FOR COAL TRANSPORTATION ROAD,https://constructafrica.com/news/tanzania-government-signs-tsh38-billion-deal-coal-transportation-road,16/01/2023
HOW MUTUAL AID ORGANIZATION IS TRANSFORMING KIRUMBA URBAN LANDSCAPE IN D.R.CONGO,https://gambetanews.com/how-mutual-aid-organization-is-transforming-kirumba-urban-landscape-in-drc/,06/01/2023
Road safety conference for 2023,https://www.worldhighways.com/wh12/news/road-safety-conference-2023,26/12/2022
iRAP Innovation 2023,https://www.worldhighways.com/events/irap-innovation-2023,21/12/2022
Event: PIARC World Road Congress in Prague,https://www.worldhighways.com/news/event-piarc-world-road-congress-prague,19/12/2022
HEAVY FLOOD RESULT TO DEATH OF MORE THAN 120 PEOPLE IN DR CONGO CAPITAL,https://gambetanews.com/heavy-flood-result-to-death-of-more-than-120-people-in-dr-congo-capital/,14/12/2022
VINCI increases stake in Greek bridge concession,https://www.worldhighways.com/wh8/news/vinci-increases-stake-greek-bridge-concession,29/11/2022
IRF’s 2022 GRAA winners announced,https://www.worldhighways.com/news/irfs-2022-graa-winners-announced,04/11/2022
CSCEC wins Republic of Srpska motorway deal,https://www.worldhighways.com/wh12/news/cscec-wins-republic-srpska-motorway-deal,06/10/2022
Strong performance for UK construction machinery segment,https://www.worldhighways.com/wh8/news/strong-performance-uk-construction-machinery-segment,12/09/2022
New road works planned for Kazakhstan,https://www.worldhighways.com/wh10/news/new-road-works-planned-kazakhstan,01/09/2022
LOBITO CORRIDOR RAIL LINE PLANNED FROM ANGOLA TO DRC,https://constructafrica.com/news/lobito-corridor-rail-line-planned-angola-drc,15/08/2022
Ammann Group Company Profile,https://www.worldhighways.com/daily-news/product/bauma-2022/ammann-group-company-profile,01/08/2022
CEA report shows high level of UK imports & exports of construction & earthmoving equipment in Q1,https://www.worldhighways.com/wh8/news/cea-report-shows-high-level-uk-imports-exports-construction-earthmoving-equipment-q1,17/06/2022
TOTAL ENERGIES TO GO AHEAD WITH US$10B UGANDA OIL PROJECT,https://constructafrica.com/news/total-energies-go-ahead-us10b-uganda-oil-project,08/06/2022
SRL offers Sign Manager for traffic control,https://www.worldhighways.com/wh12/products/srl-offers-sign-manager-traffic-control,08/06/2022
JUMBO STEEL MILL TO INVEST SH2BILLON FOR KISUMU NEW PLANT FACTOR,https://gambetanews.com/jumbo-steel-mill-to-invest-sh2billon-for-kisumu-new-plant-factor/,08/06/2022
PUTTING THE RIGHT COGS IN PLACE FOR NET-ZERO IN MINING,https://gambetanews.com/putting-the-right-cogs-in-place-for-net-zero-in-mining/,26/05/2022
Checking up on the Czech Republic's Via Salis,https://www.worldhighways.com/wh8/news/checking-czech-republics-salis,20/05/2022
GRAA winner profile: world’s longest suspension bridge has opened in Turkey,https://www.worldhighways.com/feature/graa-winner-profile-worlds-longest-suspension-bridge-has-opened-turkey,03/05/2022
"RWANDA, DRC & BURUNDI US$25M INITIATIVE CLIMATE CRISIS",https://gambetanews.com/rwanda-drc-burundi-us25m-initiative-climate-crisis/,03/05/2022
COWI acquiring FINLEY Engineering Group,https://www.worldhighways.com/wh10/news/cowi-acquiring-finley-engineering-group,27/04/2022
Key African highway concession signed,https://www.worldhighways.com/wh10/news/key-african-highway-concession-signed,19/04/2022
Dominican Republic motorway project underway,https://www.worldhighways.com/wh10/news/dominican-republic-motorway-project-underway,10/03/2022
TANZANIA AND BURUNDI SIGN AGREEMENT FOR RAILWAY LINKING BOTH COUNTRIES,https://constructafrica.com/news/tanzania-and-burundi-sign-agreement-railway-linking-both-countries,20/02/2022
Cameroon’s new transport development plan,https://www.worldhighways.com/wh8/news/cameroons-new-transport-development-plan,10/02/2022
CONSTRUCTION OF NEW GISENYI HOSPITAL TO COST €32M IN RWANDA,https://gambetanews.com/construction-of-new-gisenyi-hospital-to-cost-e32m-in-rwanda/,08/02/2022
UK equipment sales continue upward trend,https://www.worldhighways.com/wh2/news/uk-equipment-sales-continue-upward-trend,04/02/2022
NAIROBI EXPRESSWAY SET TO EASE KENYA TRAFFIC; TO BEGIN OPERATIONS IN MARCH,https://constructafrica.com/news/nairobi-expressway-set-ease-kenya-traffic-begin-operations-march,30/01/2022
New highway for Siberian Russia,https://www.worldhighways.com/wh10/news/new-highway-siberian-russia,26/01/2022
Europe’s steady demand for asphalt,https://www.worldhighways.com/wh6/news/europes-steady-demand-asphalt,04/01/2022
A new road plan benefiting DR Congo,https://www.worldhighways.com/wh8/news/new-road-plan-benefiting-dr-congo,16/12/2021
Funding secured for Congo road project,https://www.worldhighways.com/wh8/news/funding-secured-congo-road-project,14/12/2021
Komatsu unveils earthmoving digitalisation venture,https://www.worldhighways.com/wh7/news/komatsu-unveils-earthmoving-digitalisation-venture,08/12/2021
3i buys SRL Traffic Systems,https://www.worldhighways.com/wh11/products/3i-buys-srl-traffic-systems,07/12/2021
Meet Die Autobahn des Bundes,https://www.worldhighways.com/wh12/feature/meet-die-autobahn-des-bundes,08/11/2021
Financing secured for Serbian road project,https://www.worldhighways.com/wh8/news/financing-secured-serbian-road-project,29/10/2021
RADISSON HOTEL GROUP SET TO DOUBLE ITS WEST AND CENTRAL AFRICA PORTFOLIO BY 2025,https://constructafrica.com/news/radisson-hotel-group-set-double-its-west-and-central-africa-portfolio-2025,23/10/2021
East Africa’s dream of a ‘Silk Road’ in sight,https://www.worldhighways.com/feature/east-africas-dream-silk-road-sight,22/10/2021
A new Russian road project,https://www.worldhighways.com/wh10/news/new-russian-road-project,21/10/2021
Ukraine opts for Kistler,https://www.worldhighways.com/products/ukraine-opts-kistler,14/10/2021
LAKE TANGANYIKA – THE WORLD’S SECOND-DEEPEST LAKE TRIGGERS ENGINEERING CHALLENGE IN BURUNDI,https://gambetanews.com/lake-tanganyika-the-worlds-second-deepest-lake-triggers-engineering-challenge-in-burundi/,13/07/2021
AUSTRALIA’S RICHEST MAN PLANS TO BUILD THE LARGEST HYDROELECTRIC PROJECT IN AFRICA,https://gambetanews.com/australias-richest-man-to-build-africas-largest-hydroelectric-project/,17/06/2021
PORT INFRASTRUCTURE UPGRADE TO BOOST TANZANIA’S REGIONAL TRADING STANDING,https://constructafrica.com/news/port-infrastructure-upgrade-boost-tanzanias-regional-trading-standing,24/05/2021
UGANDA: AFDB SIGNS US$229.5M FINANCING AGREEMENT FOR KAMPALA-JINJA EXPRESSWAY,https://constructafrica.com/news/uganda-afdb-signs-us2295m-financing-agreement-kampala-jinja-expressway,19/03/2021
PRESIDENT OF BOTSWANA IN DR CONGO TO STRENGTHEN BILATERAL COOPERATION,https://gambetanews.com/president-of-botswana-in-dr-congo-to-strengthen-bilateral-cooperation/,16/03/2021
SOUTH AFRICA’S CYRIL RAMAPHOSA HANDSOVER AFRICAN UNION CHAIRPERSON TO PRESIDENT OF DR CONGO,https://gambetanews.com/south-africas-cyril-ramaphosa-handsover-african-union-chairperson-to-president-of-dr-congo/,09/02/2021
SOLVING THE ISSUE OF ILLEGAL MINING ACTIVITIES IN DR CONGO,https://gambetanews.com/solving-the-issue-of-illegal-mining-activities-in-dr-congo/,08/02/2021
51 AFRICAN LEADERS’ VOTE IN FAVOR OF MOUSSA FAKI MAHAMAT FOR A 2ND TERM AS AFRICAN UNION CHAIRMAN,https://gambetanews.com/51-african-leaders-vote-in-favor-of-moussa-faki-mahamat-for-a-2nd-term-as-african-union-chairman/,08/02/2021
MOROCCO AND DR CONGO SIGN AGREEMENT FOR COOPERATION IN ELECTRICITY REGULATION,https://gambetanews.com/morocco-and-dr-congo-sign-agreement-for-cooperation-in-electricity-regulation/,25/01/2021
CHINA – AFRICA COOPERATION REMAINS STABLE – CHINESE STATE COUNCILOR REAFFIRMS,https://gambetanews.com/china-africa-cooperation-remains-stable-chinese-state-councilor-reaffirms/,19/01/2021
CHINA GRANTS DEBT RELIEF TO DEMOCRATIC REPUBLIC OF CONGO,https://gambetanews.com/china-grants-debt-relief-to-democratic-republic-of-congo/,07/01/2021
R&B SINGER AKON TO FINANCE MINING ACTIVITIES IN CONGO,https://gambetanews.com/rb-singer-akon-to-finance-mining-activities-in-congo/,07/01/2021
HOW AFRICAN COUNTRIES ARE LACKING FUND TO PROVIDE GREEN ENERGY,https://gambetanews.com/how-african-countries-are-lacking-fund-to-provide-green-energy/,07/12/2020
TRINITY ENERGY TO BUILD US$500M REGIONAL REFINERY IN SOUTH SUDAN,https://gambetanews.com/trinity-energy-to-build-us500m-regional-refinery-in-south-sudan/,07/10/2020
RWANDA SIGNS US$400m METHANE GAS PRODUCTION DEAL,https://gambetanews.com/rwanda-signs-us400m-deal-to-extract-methane-gas-from-lake-kivu/,06/02/2019
PHOTOS FROM THE HIGH-LEVEL MEETING HELD IN ADDIS ABABA,https://gambetanews.com/addis-ababa-high-level-meeting/,19/01/2019
DEMOCRATIC REPUBLIC OF CONGO SIGN INGA III DAM PROJECT DEAL,https://gambetanews.com/democratic-republic-of-congo-sign-dam-project-deal/,22/10/2018
ANGOLA GOVERNMENT SET TO RECONSTRUCT NATIONAL ROADS,https://gambetanews.com/angola-government-set-to-reconstruct-national-roads/,17/10/2018
ZIMBABWE RECEIVED FUNDS FROM JAPAN FOR ROAD PROJECT,https://gambetanews.com/zimbabwe-received-funds-from-japan-for-road-project/,21/06/2018
CIMAF SET TO CONSTRUCT CEMENT PLANT IN IVORY COAST,https://gambetanews.com/cimaf-set-to-construct-cement-plant-in-ivory-coast/,16/05/2018
TANZANIA RE-ADVERTISE TENDER FOR KIGOMA PORT UPGRADE,https://gambetanews.com/tanzania-re-advertise-tender-for-kigoma-port-upgrade/,10/04/2018
NEW CARGO TO BE CONSTRUCTED IN TANZANIA,https://gambetanews.com/new-cargo-to-be-constructed-in-tanzania/,22/02/2018
MALL FOR AFRICA SPREADS TO MORE PARTS OF AFRICA.,https://gambetanews.com/mall-for-africa-expansion/,02/02/2018
Angola – Africa’s Oil Giant,https://gambetanews.com/angola-africas-oil-giant/,13/11/2017
IVANHOE MINES AGREE MOU WITH SNCC TO BUILD RAILWAY,https://gambetanews.com/ivanhoe-mines-agree-mou-with-sncc-to-build-railway/,31/10/2017
